{
  "schema": "simai.framework.unit-inventory",
  "schema_version": 1,
  "source": "simai/ui-source",
  "revision": "6fdb99ec99eb7d35642db7d385eb062a2d09f0dd",
  "release": "ui-da1869f388a6",
  "units": [
    {
      "id": "component.accordion",
      "kind": "component",
      "version": "1.0.0",
      "content_sha256": "00b47c835800399c2177810360a9fbb64995bd85e2cf76a0a620d9f53d48da56",
      "dependencies": [
        {
          "id": "core.runtime",
          "range": "^1.0.0"
        },
        {
          "id": "module.component-shared",
          "range": "^1.0.0"
        },
        {
          "id": "tokens.border",
          "range": "^1.0.0"
        },
        {
          "id": "tokens.colour",
          "range": "^1.0.0"
        },
        {
          "id": "tokens.motion",
          "range": "^1.0.0"
        },
        {
          "id": "tokens.radius",
          "range": "^1.0.0"
        },
        {
          "id": "tokens.size",
          "range": "^1.0.0"
        },
        {
          "id": "tokens.space",
          "range": "^1.0.0"
        },
        {
          "id": "tokens.typography",
          "range": "^1.0.0"
        }
      ]
    },
    {
      "id": "component.admin-menu",
      "kind": "component",
      "version": "1.0.0",
      "content_sha256": "bbbb9bf1d3e44fc7aadcc29f79a4902e7b32720ef8f8bd6f1cec8fe13ba06838",
      "dependencies": [
        {
          "id": "component.badges",
          "range": "^1.0.0"
        },
        {
          "id": "core.runtime",
          "range": "^1.0.0"
        },
        {
          "id": "module.component-shared",
          "range": "^1.0.0"
        },
        {
          "id": "tokens.border",
          "range": "^1.0.0"
        },
        {
          "id": "tokens.breakpoint",
          "range": "^1.0.0"
        },
        {
          "id": "tokens.colour",
          "range": "^1.0.0"
        },
        {
          "id": "tokens.elevation",
          "range": "^1.0.0"
        },
        {
          "id": "tokens.radius",
          "range": "^1.0.0"
        },
        {
          "id": "tokens.size",
          "range": "^1.0.0"
        },
        {
          "id": "tokens.space",
          "range": "^1.0.0"
        },
        {
          "id": "tokens.typography",
          "range": "^1.0.0"
        }
      ]
    },
    {
      "id": "component.ajax",
      "kind": "component",
      "version": "1.0.0",
      "content_sha256": "60fac37ce78634551bbea1d2d01d0b432c93d26331f43623b92a8eb1d4ea7889",
      "dependencies": [
        {
          "id": "component.sf-system",
          "range": "^1.0.0"
        }
      ]
    },
    {
      "id": "component.ajaxload",
      "kind": "component",
      "version": "1.0.0",
      "content_sha256": "6d31cd927ecce1c0d432e3d268bcb7fa718bc5431b8825b5be6875c22eed62e5",
      "dependencies": []
    },
    {
      "id": "component.alerts",
      "kind": "component",
      "version": "1.0.0",
      "content_sha256": "323d4e8f6697ec2ecf3771ff83ebd075ac6e334c3c727073176f73c9a9d0a7ec",
      "dependencies": [
        {
          "id": "tokens.border",
          "range": "^1.0.0"
        },
        {
          "id": "tokens.colour",
          "range": "^1.0.0"
        },
        {
          "id": "tokens.motion",
          "range": "^1.0.0"
        },
        {
          "id": "tokens.size",
          "range": "^1.0.0"
        },
        {
          "id": "tokens.space",
          "range": "^1.0.0"
        },
        {
          "id": "tokens.typography",
          "range": "^1.0.0"
        }
      ]
    },
    {
      "id": "component.avatars",
      "kind": "component",
      "version": "1.0.0",
      "content_sha256": "6ebc6c437f8ba1de0b9c4e613b3ecbdf17a659a77be114f013f4d6fba0e75c83",
      "dependencies": [
        {
          "id": "tokens.border",
          "range": "^1.0.0"
        },
        {
          "id": "tokens.colour",
          "range": "^1.0.0"
        },
        {
          "id": "tokens.radius",
          "range": "^1.0.0"
        },
        {
          "id": "tokens.size",
          "range": "^1.0.0"
        },
        {
          "id": "tokens.space",
          "range": "^1.0.0"
        },
        {
          "id": "tokens.typography",
          "range": "^1.0.0"
        }
      ]
    },
    {
      "id": "component.badges",
      "kind": "component",
      "version": "1.1.0",
      "content_sha256": "0fdb12b9cccf43ffb614dddd9241bbbc2ee81da3f656c96e61042d548c21e3a3",
      "dependencies": [
        {
          "id": "core.runtime",
          "range": "^1.0.0"
        },
        {
          "id": "module.component-shared",
          "range": "^1.0.0"
        },
        {
          "id": "tokens.border",
          "range": "^1.0.0"
        },
        {
          "id": "tokens.colour",
          "range": "^1.0.0"
        },
        {
          "id": "tokens.radius",
          "range": "^1.0.0"
        },
        {
          "id": "tokens.size",
          "range": "^1.0.0"
        },
        {
          "id": "tokens.space",
          "range": "^1.0.0"
        },
        {
          "id": "tokens.typography",
          "range": "^1.0.0"
        }
      ]
    },
    {
      "id": "component.breadcrumbs",
      "kind": "component",
      "version": "1.0.0",
      "content_sha256": "d9adde380930a0eb7582c52f93ee54c073ab22d7f5294e3e0226558313da0fa6",
      "dependencies": [
        {
          "id": "core.runtime",
          "range": "^1.0.0"
        },
        {
          "id": "tokens.border",
          "range": "^1.0.0"
        },
        {
          "id": "tokens.colour",
          "range": "^1.0.0"
        },
        {
          "id": "tokens.space",
          "range": "^1.0.0"
        },
        {
          "id": "tokens.typography",
          "range": "^1.0.0"
        }
      ]
    },
    {
      "id": "component.button-group",
      "kind": "component",
      "version": "1.0.0",
      "content_sha256": "baccf400f3cdf1fa842157f6530dc8df701c2f651d8e416e4ec35e0a15be96ae",
      "dependencies": [
        {
          "id": "core.runtime",
          "range": "^1.0.0"
        },
        {
          "id": "module.component-shared",
          "range": "^1.0.0"
        },
        {
          "id": "tokens.border",
          "range": "^1.0.0"
        },
        {
          "id": "tokens.colour",
          "range": "^1.0.0"
        },
        {
          "id": "tokens.radius",
          "range": "^1.0.0"
        },
        {
          "id": "tokens.size",
          "range": "^1.0.0"
        },
        {
          "id": "tokens.space",
          "range": "^1.0.0"
        },
        {
          "id": "tokens.typography",
          "range": "^1.0.0"
        }
      ]
    },
    {
      "id": "component.buttons",
      "kind": "component",
      "version": "1.1.0",
      "content_sha256": "1bce022da26fa114dfc41cdb6f79bd239d07760f2e7ebc2830c2c76e12fc19d0",
      "dependencies": [
        {
          "id": "component.spinner",
          "range": "^1.0.0"
        },
        {
          "id": "core.runtime",
          "range": "^1.0.0"
        },
        {
          "id": "module.component-shared",
          "range": "^1.0.0"
        },
        {
          "id": "tokens.border",
          "range": "^1.0.0"
        },
        {
          "id": "tokens.colour",
          "range": "^1.0.0"
        },
        {
          "id": "tokens.motion",
          "range": "^1.0.0"
        },
        {
          "id": "tokens.radius",
          "range": "^1.0.0"
        },
        {
          "id": "tokens.size",
          "range": "^1.0.0"
        },
        {
          "id": "tokens.space",
          "range": "^1.0.0"
        },
        {
          "id": "tokens.typography",
          "range": "^1.0.0"
        }
      ]
    },
    {
      "id": "component.carousel",
      "kind": "component",
      "version": "1.0.0",
      "content_sha256": "67089466521d353ace8aeca7ba2add4d9babf3865748e51bc1c43aab71ac1801",
      "dependencies": [
        {
          "id": "component.swiper",
          "range": "^1.0.0"
        },
        {
          "id": "tokens.border",
          "range": "^1.0.0"
        },
        {
          "id": "tokens.colour",
          "range": "^1.0.0"
        },
        {
          "id": "tokens.opacity",
          "range": "^1.0.0"
        },
        {
          "id": "tokens.radius",
          "range": "^1.0.0"
        },
        {
          "id": "tokens.size",
          "range": "^1.0.0"
        },
        {
          "id": "tokens.space",
          "range": "^1.0.0"
        }
      ]
    },
    {
      "id": "component.checkbox",
      "kind": "component",
      "version": "1.0.0",
      "content_sha256": "eba3e9787766634703d9b3908a955ee0dd343bcfe2e1040c8b800be3c5a66e23",
      "dependencies": [
        {
          "id": "core.runtime",
          "range": "^1.0.0"
        },
        {
          "id": "module.component-shared",
          "range": "^1.0.0"
        },
        {
          "id": "tokens.border",
          "range": "^1.0.0"
        },
        {
          "id": "tokens.colour",
          "range": "^1.0.0"
        },
        {
          "id": "tokens.motion",
          "range": "^1.0.0"
        },
        {
          "id": "tokens.size",
          "range": "^1.0.0"
        },
        {
          "id": "tokens.space",
          "range": "^1.0.0"
        },
        {
          "id": "tokens.typography",
          "range": "^1.0.0"
        }
      ]
    },
    {
      "id": "component.clipboard",
      "kind": "component",
      "version": "1.0.0",
      "content_sha256": "7759cadd43ce35bf32aa90572294469ee306ab26efe7733a88dcf85f8083f242",
      "dependencies": [
        {
          "id": "component.buttons",
          "range": "^1.0.0"
        },
        {
          "id": "component.icon-buttons",
          "range": "^1.0.0"
        },
        {
          "id": "component.icons",
          "range": "^1.0.0"
        },
        {
          "id": "core.runtime",
          "range": "^1.0.0"
        },
        {